{
  "$schema": "../schema/app.schema.json",
  "order": 40,
  "name": "Chat Log Viewer",
  "description": "Read Claude Code and Codex session logs, grouped by folder or by time.",
  "icon": "🗯",
  "enabled": true,
  "root": "${paths.playround}/chatlog-viewer",
  "basePath": "/chatlog",
  "ports": {
    "http": 16010
  },
  "routes": {
    "proxy": [
      {
        "upstream": "127.0.0.1:${ports.http}"
      }
    ]
  },
  "launch": {
    "args": [
      "-Port",
      "${ports.http}",
      "--base-path",
      "${basePath}"
    ]
  }
}
