{
  "$schema": "../schema/app.schema.json",
  "order": 70,
  "name": "Novelia Downloader",
  "description": "Novel download and translation queue, with its own web page.",
  "icon": "📥",
  "enabled": false,
  "root": "${paths.crawler}/novelia-downloader-v2",
  "ports": {
    "http": 18030
  },
  "launch": {
    "args": [
      "-Port",
      "${ports.http}"
    ]
  }
}
