{
  "$schema": "../schema/app.schema.json",
  "order": 30,
  "name": "Visual Novel Database",
  "description": "Visual novel catalogue, artwork and music library.",
  "icon": "📚",
  "enabled": true,
  "root": "${paths.project}/VisualNovelDatabase",
  "basePath": "/vndb",
  "ports": {
    "frontend": 17040,
    "vndbserve": 17041,
    "imgserve": 17042,
    "userserve": 17043,
    "transserve": 17044,
    "musicserve": 17045,
    "logserve": 17046
  },
  "env": {
    "NEXT_PORT": "${ports.frontend}",
    "VNDBSERVE_PORT": "${ports.vndbserve}",
    "IMGSERVE_PORT": "${ports.imgserve}",
    "USERSERVE_PORT": "${ports.userserve}",
    "TRANSSERVE_PORT": "${ports.transserve}",
    "MUSICSERVE_PORT": "${ports.musicserve}",
    "LOGSERVE_PORT": "${ports.logserve}"
  },
  "routes": {
    "snippet": "${root}/Caddyfile.snippet",
    "env": "${root}/caddy-env.ps1"
  },
  "launch": {
    "args": [
      "-NoCaddy"
    ]
  }
}
